city,party,leader,tweet,tweet_time
derry,,Jeremy-Corbyn,Jesus I'd love to see Jeremy Corbyn as next PM not only for his policies but just to see the fumeeee from the likes… https://t.co/Qkz7PavHEr,Fri Nov 29 13:19:52 +0000 2019
derry,,Jeremy-Corbyn,"@jamescoe07 @AntigoneMarkTwo @bbcquestiontime This is NOT I repeat NOT Jeremy Corbyn at the funeral of a Volunteer,… https://t.co/ZBrhilm6HU",Fri Nov 29 13:03:06 +0000 2019
derry,Conservative-Party,,British Bias Corporation now media wing of The nasty Tory Conservative party.The Paper review is Toxic TV https://t.co/vE3e8uuAkm,Fri Nov 29 09:25:23 +0000 2019
derry,Brexit-Party,,@traderpd @MarieAnnUK So you voted Brexit for WORSE deals with the EU and its trade partners and potential supplica… https://t.co/np9MDg9fZa,Fri Nov 29 09:27:47 +0000 2019
derry,,Boris-Johnson,Boris Johnson branded children of single mothers 'ignorant and illegitimate' https://t.co/C0xcWAZ4iB,Fri Nov 29 14:20:43 +0000 2019
derry,,Boris-Johnson,"WHY IS BORIS JOHNSON'S FATHER BEING INTERVIEWED?

This is almost as annoying as Ivanka and co speaking on behalf of Trump.",Fri Nov 29 12:22:57 +0000 2019
derry,,Boris-Johnson,"@JamieBrysonCPNI Billy Hutchinson said it right, who are you going to fight with, Boris Johnson, the British government?",Fri Nov 29 11:56:54 +0000 2019
derry,,Boris-Johnson,"@tompeck You only went to try to safe face for boris Johnson because he refused to go , say it as it is for once, d… https://t.co/RSIUylEpv6",Fri Nov 29 10:12:08 +0000 2019
